{
  "activeCard": null,
  "activeInvestigatorId": "c01001",
  "activePlayerId": "00000000-0000-0000-0000-000000000001",
  "acts": {
    "c01108": {
      "advanceCost": {
        "contents": [
          {
            "contents": 2,
            "tag": "PerPlayer"
          },
          {
            "tag": "Anywhere"
          }
        ],
        "tag": "GroupClueCost"
      },
      "breaches": null,
      "cardId": "419015cc-abb7-41d0-9795-7ec1d981955f",
      "cardsUnderneath": [],
      "deckId": 1,
      "flipped": false,
      "id": "c01108",
      "keys": [],
      "meta": null,
      "modifiers": [],
      "sequence": [
        1,
        "A"
      ],
      "tokens": [],
      "treacheries": [],
      "usedWheelOfFortuneX": false
    }
  },
  "agendas": {
    "c01105": {
      "cardId": "d96ae83d-bf74-48e1-8233-78b565f30716",
      "cardsUnderneath": [],
      "deckId": 1,
      "doom": 0,
      "doomThreshold": {
        "contents": 3,
        "tag": "Static"
      },
      "flipped": false,
      "id": "c01105",
      "meta": null,
      "modifiers": [],
      "removeDoomMatchers": {
        "removeDoomActs": {
          "tag": "AnyAct"
        },
        "removeDoomAgendas": {
          "tag": "AnyAgenda"
        },
        "removeDoomAssets": {
          "tag": "AnyAsset"
        },
        "removeDoomEnemies": {
          "tag": "AnyEnemy"
        },
        "removeDoomEvents": {
          "tag": "AnyEvent"
        },
        "removeDoomInvestigators": {
          "tag": "Anyone"
        },
        "removeDoomLocations": {
          "tag": "Anywhere"
        },
        "removeDoomSkills": {
          "tag": "AnySkill"
        },
        "removeDoomTreacheries": {
          "tag": "AnyTreachery"
        }
      },
      "sequence": {
        "agendaSequenceSide": "A",
        "agendaSequenceStep": 1
      },
      "tokens": [],
      "treacheries": [],
      "usedWheelOfFortuneX": false
    }
  },
  "assets": {},
  "cards": {},
  "concealed": {},
  "encounterDeckSize": 26,
  "enemies": {},
  "enemyAttackTargets": [],
  "events": {},
  "focusedCards": [],
  "focusedChaosTokens": [],
  "focusedTarotCards": [],
  "foundCards": {},
  "gameSettings": {
    "settingsAbilitiesCannotReactToThemselves": true,
    "settingsAchievementsEnabled": true,
    "settingsAsIfRuling": "chapter1",
    "settingsRolledUltimatumOrBoon": null,
    "settingsScreamedAllies": [],
    "settingsStrictAsIfAt": false,
    "settingsUltimatumsAndBoons": [],
    "settingsUltimatumsAndBoonsEnabled": true
  },
  "gameState": {
    "tag": "IsActive"
  },
  "git": "contract-fixture",
  "highlightedCards": [],
  "id": "00000000-0000-0000-0000-000000000003",
  "inAction": false,
  "inSetup": false,
  "investigators": {
    "c01001": {
      "actionsPerformed": [],
      "actionsTaken": [],
      "additionalActions": [],
      "agility": 2,
      "art": "c01001",
      "assets": [],
      "assignedHealthDamage": 0,
      "assignedHealthHeal": [],
      "assignedSanityDamage": 0,
      "assignedSanityHeal": [],
      "beganRoundAt": "782de537-8f5d-4eda-b849-2362e28402e5",
      "bondedCards": [],
      "cardCode": "c01001",
      "cardsUnderneath": [],
      "class": "Guardian",
      "combat": 4,
      "connectedLocations": [],
      "deck": [],
      "deckBuildingAdjustments": [],
      "deckSize": 0,
      "deckUrl": null,
      "decks": [],
      "defeated": false,
      "discard": [],
      "discarding": null,
      "discover": null,
      "drawing": null,
      "drawnCards": [],
      "drivenInsane": false,
      "eliminated": false,
      "endedTurn": false,
      "engagedEnemies": [],
      "events": [],
      "excludeFromMulligan": [],
      "form": {
        "tag": "RegularForm"
      },
      "formMeta": null,
      "hand": [],
      "handSize": 8,
      "health": 9,
      "horrorHealed": 0,
      "id": "c01001",
      "ignoredPerformedActions": [],
      "intellect": 3,
      "keys": [],
      "killed": false,
      "log": {
        "crossedOut": [],
        "options": [],
        "orderedKeys": [],
        "partners": {},
        "recorded": [],
        "recordedCounts": [],
        "recordedSets": []
      },
      "mentalTrauma": 0,
      "meta": null,
      "modifiers": [],
      "movement": null,
      "mulligansTaken": 0,
      "mutated": null,
      "name": {
        "subtitle": "The Fed",
        "title": "Roland Banks"
      },
      "physicalTrauma": 0,
      "placement": {
        "contents": "782de537-8f5d-4eda-b849-2362e28402e5",
        "tag": "AtLocation"
      },
      "playerId": "00000000-0000-0000-0000-000000000001",
      "previousLocation": null,
      "remainingActions": 3,
      "resigned": false,
      "sanity": 5,
      "scarletKeys": [],
      "sealedChaosTokens": [],
      "seals": [],
      "search": null,
      "settings": {
        "globalSettings": {
          "ignoreUnrelatedSkillTestTriggers": true
        },
        "perCardSettings": {}
      },
      "sideDeck": null,
      "skills": [],
      "skippedWindow": false,
      "slots": [
        [
          "HandSlot",
          [
            {
              "assets": [],
              "source": {
                "contents": "c01001",
                "tag": "InvestigatorSource"
              },
              "tag": "Slot"
            },
            {
              "assets": [],
              "source": {
                "contents": "c01001",
                "tag": "InvestigatorSource"
              },
              "tag": "Slot"
            }
          ]
        ],
        [
          "BodySlot",
          [
            {
              "assets": [],
              "source": {
                "contents": "c01001",
                "tag": "InvestigatorSource"
              },
              "tag": "Slot"
            }
          ]
        ],
        [
          "AllySlot",
          [
            {
              "assets": [],
              "source": {
                "contents": "c01001",
                "tag": "InvestigatorSource"
              },
              "tag": "Slot"
            }
          ]
        ],
        [
          "AccessorySlot",
          [
            {
              "assets": [],
              "source": {
                "contents": "c01001",
                "tag": "InvestigatorSource"
              },
              "tag": "Slot"
            }
          ]
        ],
        [
          "ArcaneSlot",
          [
            {
              "assets": [],
              "source": {
                "contents": "c01001",
                "tag": "InvestigatorSource"
              },
              "tag": "Slot"
            },
            {
              "assets": [],
              "source": {
                "contents": "c01001",
                "tag": "InvestigatorSource"
              },
              "tag": "Slot"
            }
          ]
        ],
        [
          "TarotSlot",
          [
            {
              "assets": [],
              "source": {
                "contents": "c01001",
                "tag": "InvestigatorSource"
              },
              "tag": "Slot"
            }
          ]
        ],
        [
          "HeadSlot",
          [
            {
              "assets": [],
              "source": {
                "contents": "c01001",
                "tag": "InvestigatorSource"
              },
              "tag": "Slot"
            }
          ]
        ]
      ],
      "spentXp": 0,
      "startsWith": [],
      "startsWithInHand": [],
      "supplies": [],
      "taboo": null,
      "tokens": [],
      "traits": [
        "Agency",
        "Detective"
      ],
      "treacheries": [],
      "unhealedHorrorThisRound": 0,
      "usedAbilities": [],
      "usedAdditionalActions": [],
      "willpower": 3,
      "xp": 0
    }
  },
  "killedInvestigators": {},
  "leadInvestigatorId": "c01001",
  "locations": {
    "782de537-8f5d-4eda-b849-2362e28402e5": {
      "assets": [],
      "beingRemoved": false,
      "brazier": null,
      "breaches": null,
      "canBeFlipped": false,
      "cardCode": "c01111",
      "cardId": "4db426b4-641e-4812-8d10-27fc6470ef6e",
      "cardsUnderneath": [],
      "concealedCards": [],
      "connectedLocations": [],
      "connectedMatchers": [],
      "connectsTo": [],
      "costToEnterUnrevealed": {
        "tag": "Free"
      },
      "directions": [],
      "enemies": [],
      "events": [],
      "floodLevel": null,
      "globalMeta": {},
      "grantedConnections": [],
      "group": null,
      "id": "782de537-8f5d-4eda-b849-2362e28402e5",
      "investigateSkill": "SkillIntellect",
      "investigators": [
        "c01001"
      ],
      "keys": [],
      "label": "study",
      "meta": null,
      "modifiers": [],
      "outOfGame": false,
      "placedChaosTokens": [],
      "placement": null,
      "position": null,
      "revealClues": {
        "contents": 2,
        "tag": "PerPlayer"
      },
      "revealed": true,
      "revealedConnectedMatchers": [],
      "revealedSymbol": "Circle",
      "scarletKeys": [],
      "sealedChaosTokens": [],
      "seals": [],
      "shroud": {
        "contents": 2,
        "tag": "Static"
      },
      "symbol": "Circle",
      "tokens": [
        [
          "Clue",
          2
        ]
      ],
      "treacheries": [],
      "withoutClues": false
    }
  },
  "log": [
    {
      "tag": "LogRowLegacy",
      "contents": [
        "Legacy contract fixture row.",
        7
      ]
    },
    {
      "tag": "LogRowStructured",
      "contents": {
        "seq": 1,
        "step": 8,
        "kind": "Structure",
        "body": [
          {
            "tag": "LogText",
            "contents": "Everyone sees "
          },
          {
            "tag": "LogRefPart",
            "contents": {
              "kind": "RefCard",
              "name": "Contract fixture card",
              "cardCode": "c01016",
              "cardId": "00000000-0000-0000-0000-00000000039d",
              "entityId": null,